Material,Unit,Price,Finish,Application,Supplier,Quality Grade
Granite Blocks,ton,162,Polished,Facade cladding and flooring,SkyRise Granite,Premium
Limestone Blocks,ton,81,Split Face,Wall cladding and construction,SkyRise Limestone,Standard
Marble Tiles,m²,275,Honed,Interior finishing and features,SkyRise Marble,Premium
Basalt Paving,m²,49,Natural,Outdoor paving and pathways,SkyRise Basalt,Standard
Slate Roofing Tiles,ton,127,Natural,Roofing material,SkyRise Slate,Standard
Portuguese Limestone,ton,110,Custard-cut,Premium cladding,SkyRise Premium Stone,Premium
